{
  "paper_id": "colorectal_cfDNA_traditional_015",
  "pmid": "39121006",
  "title": "Circulating small extracellular vesicle RNA profiling for the detection of T1a stage colorectal cancer and precancerous advanced adenoma.",
  "year": 2024,
  "journal": "eLife",
  "doi": "10.7554/eLife.88675",
  "cancer_type": "colorectal",
  "category": "cfDNA_traditional",
  "study_design": "other",
  "cohort_type": "mixed",
  "sample_size": 60,
  "input_modalities": [
    "CT",
    "cfDNA_methylation"
  ],
  "model_type": "other",
  "performance_raw": {
    "auc": null,
    "sensitivity": 1.0,
    "specificity": 0.99,
    "early_stage_sensitivity": null
  },
  "has_stage_info": false,
  "validation_type": "none",
  "notes": "PubMed search: colorectal / cfDNA_traditional.",
  "quality_flags": {
    "screening_relevant": true,
    "has_external_validation": false,
    "case_control_design": false,
    "impact_factor": 6.4,
    "if_above_10": false,
    "if_unknown": false,
    "tier": "extended"
  }
}