{
  "paper_id": "esophageal_cfDNA_traditional_005",
  "pmid": "41291517",
  "title": "Cell-free DNA methylation and fragmentomics-based liquid biopsy for accurate esophageal cancer detection.",
  "year": 2025,
  "journal": "BMC cancer",
  "doi": "10.1186/s12885-025-15150-4",
  "cancer_type": "esophageal",
  "category": "cfDNA_traditional",
  "study_design": "other",
  "cohort_type": "clinical",
  "sample_size": null,
  "input_modalities": [
    "cfDNA_methylation",
    "cfDNA_fragmentomics"
  ],
  "model_type": "other",
  "performance_raw": {
    "auc": null,
    "sensitivity": 0.99,
    "specificity": 0.9782,
    "early_stage_sensitivity": null
  },
  "has_stage_info": false,
  "validation_type": "external_validation",
  "notes": "PubMed search: esophageal / cfDNA_traditional.",
  "quality_flags": {
    "screening_relevant": false,
    "has_external_validation": true,
    "case_control_design": false,
    "impact_factor": 3.4,
    "if_above_10": false,
    "if_unknown": false,
    "tier": "low_if"
  }
}