{
  "paper_id": "lung_cfDNA_traditional_050",
  "pmid": "35870539",
  "title": "Improving malignancy risk prediction of indeterminate pulmonary nodules with imaging features and biomarkers.",
  "year": null,
  "journal": "Clinica chimica acta; international journal of clinical chemistry",
  "doi": "10.1016/j.cca.2022.07.010",
  "cancer_type": "lung",
  "category": "cfDNA_traditional",
  "study_design": "other",
  "cohort_type": "clinical",
  "sample_size": 338,
  "input_modalities": [
    "blood_protein",
    "clinical_features",
    "imaging"
  ],
  "model_type": "random_forest",
  "performance_raw": {
    "auc": 0.76,
    "sensitivity": null,
    "specificity": null,
    "early_stage_sensitivity": null
  },
  "has_stage_info": false,
  "validation_type": "none",
  "notes": "Remapped from original lung library. [Recategorized from LDCT to cfDNA_traditional: no CT modality detected]",
  "quality_flags": {
    "screening_relevant": false,
    "has_external_validation": false,
    "case_control_design": false,
    "impact_factor": 9.3,
    "if_above_10": false,
    "if_unknown": false,
    "tier": "extended"
  }
}