{
  "paper_id": "prostate_cfDNA_traditional_010",
  "pmid": "34238128",
  "title": "A DNA methylation profile of long non-coding RNAs can predict OS in prostate cancer.",
  "year": 2021,
  "journal": "Bioengineered",
  "doi": "10.1080/21655979.2021.1945991",
  "cancer_type": "prostate",
  "category": "cfDNA_traditional",
  "study_design": "other",
  "cohort_type": "screening",
  "sample_size": null,
  "input_modalities": [
    "CT",
    "cfDNA_methylation"
  ],
  "model_type": "logistic_regression",
  "performance_raw": {
    "auc": 0.89,
    "sensitivity": null,
    "specificity": null,
    "early_stage_sensitivity": null
  },
  "has_stage_info": false,
  "validation_type": "none",
  "notes": "PubMed search: prostate / cfDNA_traditional.",
  "quality_flags": {
    "screening_relevant": true,
    "has_external_validation": false,
    "case_control_design": false,
    "impact_factor": null,
    "if_above_10": null,
    "if_unknown": true,
    "tier": "unknown"
  }
}