{
  "paper_id": "lung_cfDNA_traditional_017",
  "pmid": "38743638",
  "title": "Ultrasensitive Detection of Tumor Suppressor Gene Methylation by Piezoelectric Sensing Based on Enrichment of Transcription Activator-Like Effectors.",
  "year": null,
  "journal": "Analytical chemistry",
  "doi": "10.1021/acs.analchem.4c00484",
  "cancer_type": "lung",
  "category": "cfDNA_traditional",
  "study_design": "other",
  "cohort_type": "screening",
  "sample_size": null,
  "input_modalities": [
    "cfDNA_methylation"
  ],
  "model_type": "other",
  "performance_raw": {
    "auc": null,
    "sensitivity": 0.05,
    "specificity": null,
    "early_stage_sensitivity": null
  },
  "has_stage_info": false,
  "validation_type": "none",
  "notes": "Remapped from original lung library.",
  "quality_flags": {
    "screening_relevant": true,
    "has_external_validation": false,
    "case_control_design": false,
    "impact_factor": null,
    "if_above_10": null,
    "if_unknown": true,
    "tier": "unknown"
  }
}