{
  "paper_id": "kidney_cfDNA_traditional_006",
  "pmid": "36170366",
  "title": "Accurate detection of benign and malignant renal tumor subtypes with MethylBoostER: An epigenetic marker-driven learning framework.",
  "year": 2022,
  "journal": "Science advances",
  "doi": "10.1126/sciadv.abn9828",
  "cancer_type": "kidney",
  "category": "cfDNA_traditional",
  "study_design": "other",
  "cohort_type": "clinical",
  "sample_size": 185,
  "input_modalities": [
    "cfDNA_methylation"
  ],
  "model_type": "other",
  "performance_raw": {
    "auc": 0.988,
    "sensitivity": null,
    "specificity": null,
    "early_stage_sensitivity": null
  },
  "has_stage_info": false,
  "validation_type": "external_validation",
  "notes": "Supplemental search: kidney / cfDNA_traditional.",
  "quality_flags": {
    "screening_relevant": false,
    "has_external_validation": true,
    "case_control_design": false,
    "impact_factor": null,
    "if_above_10": null,
    "if_unknown": true,
    "tier": "unknown"
  }
}