{
  "paper_id": "lung_cfDNA_traditional_044",
  "pmid": "33653596",
  "title": "Autoantibody Signatures as a Biomarker Panel for the Detection of Nasopharyngeal Carcinoma.",
  "year": null,
  "journal": "Archives of medical research",
  "doi": "10.1016/j.arcmed.2021.02.007",
  "cancer_type": "lung",
  "category": "cfDNA_traditional",
  "study_design": "case_control",
  "cohort_type": "clinical",
  "sample_size": 131,
  "input_modalities": [
    "other"
  ],
  "model_type": "other",
  "performance_raw": {
    "auc": 0.674,
    "sensitivity": null,
    "specificity": null,
    "early_stage_sensitivity": null
  },
  "has_stage_info": false,
  "validation_type": "none",
  "notes": "Remapped from original lung library. [Recategorized from LDCT to cfDNA_traditional: no CT modality detected]",
  "quality_flags": {
    "screening_relevant": true,
    "has_external_validation": false,
    "case_control_design": true,
    "impact_factor": null,
    "if_above_10": null,
    "if_unknown": true,
    "tier": "unknown"
  }
}