{
  "paper_id": "liver_cfDNA_traditional_002",
  "pmid": "41390024",
  "title": "BAG6 promotes hepatocellular carcinoma growth via enhancing PLK1-mediated aerobic glycolysis.",
  "year": 2025,
  "journal": "International journal of biological macromolecules",
  "doi": "10.1016/j.ijbiomac.2025.149653",
  "cancer_type": "liver",
  "category": "cfDNA_traditional",
  "study_design": "other",
  "cohort_type": "screening",
  "sample_size": null,
  "input_modalities": [
    "blood_protein",
    "cfDNA_methylation"
  ],
  "model_type": "other",
  "performance_raw": {
    "auc": 0.935,
    "sensitivity": null,
    "specificity": null,
    "early_stage_sensitivity": null
  },
  "has_stage_info": false,
  "validation_type": "none",
  "notes": "PubMed search: liver / cfDNA_traditional.",
  "quality_flags": {
    "screening_relevant": true,
    "has_external_validation": false,
    "case_control_design": false,
    "impact_factor": null,
    "if_above_10": null,
    "if_unknown": true,
    "tier": "unknown"
  }
}