{
  "paper_id": "lung_LDCT_traditional_094",
  "pmid": "38569236",
  "title": "Robust deep learning from incomplete annotation for accurate lung nodule detection.",
  "year": null,
  "journal": "Computers in biology and medicine",
  "doi": "10.1016/j.compbiomed.2024.108361",
  "cancer_type": "lung",
  "category": "LDCT_traditional",
  "study_design": "other",
  "cohort_type": "clinical",
  "sample_size": null,
  "input_modalities": [
    "LDCT",
    "CT"
  ],
  "model_type": "deep_learning",
  "performance_raw": {
    "auc": null,
    "sensitivity": 0.574,
    "specificity": null,
    "early_stage_sensitivity": null
  },
  "has_stage_info": false,
  "validation_type": "none",
  "notes": "Remapped from original lung library.",
  "quality_flags": {
    "screening_relevant": false,
    "has_external_validation": false,
    "case_control_design": false,
    "impact_factor": 7.7,
    "if_above_10": false,
    "if_unknown": false,
    "tier": "extended"
  }
}