{
  "paper_id": "lung_LDCT_traditional_079",
  "pmid": "38848168",
  "title": "LDCT image biomarkers that matter most for the deep learning classification of indeterminate pulmonary nodules.",
  "year": null,
  "journal": "Cancer biomarkers : section A of Disease markers",
  "doi": "10.3233/CBM-230444",
  "cancer_type": "lung",
  "category": "LDCT_traditional",
  "study_design": "other",
  "cohort_type": "screening",
  "sample_size": null,
  "input_modalities": [
    "LDCT",
    "CT"
  ],
  "model_type": "deep_learning",
  "performance_raw": {
    "auc": 0.808,
    "sensitivity": null,
    "specificity": null,
    "early_stage_sensitivity": null
  },
  "has_stage_info": false,
  "validation_type": "none",
  "notes": "Remapped from original lung library.",
  "quality_flags": {
    "screening_relevant": true,
    "has_external_validation": false,
    "case_control_design": false,
    "impact_factor": 3.2,
    "if_above_10": false,
    "if_unknown": false,
    "tier": "low_if"
  }
}