{
  "paper_id": "cervical_cfDNA_traditional_010",
  "pmid": "32317020",
  "title": "Evaluation of a methylation classifier for predicting pre-cancer lesion among women with abnormal results between HPV16/18 and cytology.",
  "year": 2020,
  "journal": "Clinical epigenetics",
  "doi": "10.1186/s13148-020-00849-x",
  "cancer_type": "cervical",
  "category": "cfDNA_traditional",
  "study_design": "other",
  "cohort_type": "screening",
  "sample_size": 67,
  "input_modalities": [
    "cfDNA_methylation"
  ],
  "model_type": "other",
  "performance_raw": {
    "auc": 0.86,
    "sensitivity": 0.05,
    "specificity": 0.766,
    "early_stage_sensitivity": null
  },
  "has_stage_info": false,
  "validation_type": "none",
  "notes": "PubMed search: cervical / cfDNA_traditional.",
  "quality_flags": {
    "screening_relevant": true,
    "has_external_validation": false,
    "case_control_design": false,
    "impact_factor": 5.7,
    "if_above_10": false,
    "if_unknown": false,
    "tier": "extended"
  }
}