{
  "paper_id": "lung_cfDNA_LDCT_traditional_013",
  "pmid": "39747216",
  "title": "Integrated multiomics signatures to optimize the accurate diagnosis of lung cancer.",
  "year": null,
  "journal": "Nature communications",
  "doi": "10.1038/s41467-024-55594-z",
  "cancer_type": "lung",
  "category": "cfDNA_LDCT_traditional",
  "study_design": "other",
  "cohort_type": "clinical",
  "sample_size": 2032,
  "input_modalities": [
    "cfDNA_methylation"
  ],
  "model_type": "other",
  "performance_raw": {
    "auc": 0.923,
    "sensitivity": null,
    "specificity": null,
    "early_stage_sensitivity": null
  },
  "has_stage_info": false,
  "validation_type": "none",
  "notes": "Remapped from original lung library.",
  "quality_flags": {
    "screening_relevant": false,
    "has_external_validation": false,
    "case_control_design": false,
    "impact_factor": 14.7,
    "if_above_10": true,
    "if_unknown": false,
    "tier": "core"
  }
}