{
  "paper_id": "lung_cfDNA_traditional_038",
  "pmid": "35998020",
  "title": "Whole-genome bisulfite sequencing analysis of circulating tumour DNA for the detection and molecular classification of cancer.",
  "year": null,
  "journal": "Clinical and translational medicine",
  "doi": "10.1002/ctm2.1014",
  "cancer_type": "lung",
  "category": "cfDNA_traditional",
  "study_design": "other",
  "cohort_type": "screening",
  "sample_size": 123,
  "input_modalities": [
    "ctDNA"
  ],
  "model_type": "other_ML",
  "performance_raw": {
    "auc": 0.971,
    "sensitivity": null,
    "specificity": null,
    "early_stage_sensitivity": null
  },
  "has_stage_info": false,
  "validation_type": "none",
  "notes": "Remapped from original lung library. [Recategorized from LDCT to cfDNA_traditional: no CT modality detected]",
  "quality_flags": {
    "screening_relevant": true,
    "has_external_validation": false,
    "case_control_design": false,
    "impact_factor": 10.6,
    "if_above_10": true,
    "if_unknown": false,
    "tier": "core"
  }
}